{"AllowDangerousPayloadPreview":false,"CompilerVersion":"raidlands-airanim-1","Profiles":{"curved_pass":{"CompiledTrack":{"CompilerVersion":"raidlands-airanim-1","CoordinateSystem":"unity-target-relative-local-v1","DurationSeconds":6,"Frames":[{"Qw":0.967274,"Qx":0.057692,"Qy":0.246649,"Qz":-0.014711,"Time":0,"X":-40,"Y":80,"Z":-180},{"Qw":0.965894,"Qx":0.057307,"Qy":0.252184,"Qz":-0.012968,"Time":0.033333,"X":-38.641956,"Y":79.663684,"Z":-177.545046},{"Qw":0.964621,"Qx":0.05693,"Qy":0.257177,"Qz":-0.011184,"Time":0.066667,"X":-37.236737,"Y":79.321675,"Z":-175.07003},{"Qw":0.963454,"Qx":0.056561,"Qy":0.261668,"Qz":-0.009362,"Time":0.1,"X":-35.787712,"Y":78.974379,"Z":-172.576383},{"Qw":0.962391,"Qx":0.056197,"Qy":0.265688,"Qz":-0.007505,"Time":0.133333,"X":-34.298252,"Y":78.622203,"Z":-170.06554},{"Qw":0.961429,"Qx":0.055839,"Qy":0.269266,"Qz":-0.005616,"Time":0.166667,"X":-32.771726,"Y":78.265553,"Z":-167.538933},{"Qw":0.960567,"Qx":0.055486,"Qy":0.27243,"Qz":-0.003696,"Time":0.2,"X":-31.211503,"Y":77.904837,"Z":-164.997996},{"Qw":0.959803,"Qx":0.055137,"Qy":0.275199,"Qz":-0.001748,"Time":0.233333,"X":-29.620954,"Y":77.54046,"Z":-162.44416},{"Qw":0.959135,"Qx":0.05479,"Qy":0.277595,"Qz":0.000226,"Time":0.266667,"X":-28.003447,"Y":77.17283,"Z":-159.878861},{"Qw":0.95856,"Qx":0.054444,"Qy":0.279631,"Qz":0.002225,"Time":0.3,"X":-26.362353,"Y":76.802353,"Z":-157.303529},{"Qw":0.958078,"Qx":0.054098,"Qy":0.281323,"Qz":0.004247,"Time":0.333333,"X":-24.701041,"Y":76.429436,"Z":-154.7196},{"Qw":0.957686,"Qx":0.053751,"Qy":0.282681,"Qz":0.006292,"Time":0.366667,"X":-23.022881,"Y":76.054486,"Z":-152.128505},{"Qw":0.957384,"Qx":0.053401,"Qy":0.283714,"Qz":0.008357,"Time":0.4,"X":-21.331242,"Y":75.677908,"Z":-149.531678},{"Qw":0.957171,"Qx":0.053046,"Qy":0.28443,"Qz":0.010444,"Time":0.433333,"X":-19.629494,"Y":75.300111,"Z":-146.930551},{"Qw":0.957046,"Qx":0.052684,"Qy":0.284833,"Qz":0.01255,"Time":0.466667,"X":-17.921007,"Y":74.921501,"Z":-144.326559},{"Qw":0.957008,"Qx":0.052314,"Qy":0.284926,"Qz":0.014675,"Time":0.5,"X":-16.20915,"Y":74.542484,"Z":-141.721133},{"Qw":0.957058,"Qx":0.051934,"Qy":0.28471,"Qz":0.016819,"Time":0.533333,"X":-14.497294,"Y":74.163466,"Z":-139.115707},{"Qw":0.957195,"Qx":0.051542,"Qy":0.284183,"Qz":0.018981,"Time":0.566667,"X":-12.788807,"Y":73.784856,"Z":-136.511715},{"Qw":0.95742,"Qx":0.051134,"Qy":0.283344,"Qz":0.021162,"Time":0.6,"X":-11.087059,"Y":73.407059,"Z":-133.910588},{"Qw":0.957733,"Qx":0.050709,"Qy":0.282188,"Qz":0.02336,"Time":0.633333,"X":-9.39542,"Y":73.030482,"Z":-131.313761},{"Qw":0.958135,"Qx":0.050264,"Qy":0.280707,"Qz":0.025577,"Time":0.666667,"X":-7.71726,"Y":72.655531,"Z":-128.722666},{"Qw":0.958627,"Qx":0.049796,"Qy":0.278892,"Qz":0.027812,"Time":0.7,"X":-6.055948,"Y":72.282614,"Z":-126.138736},{"Qw":0.95921,"Qx":0.049302,"Qy":0.276733,"Qz":0.030065,"Time":0.733333,"X":-4.414854,"Y":71.912137,"Z":-123.563405},{"Qw":0.959886,"Qx":0.048777,"Qy":0.274216,"Qz":0.032337,"Time":0.766667,"X":-2.797347,"Y":71.544507,"Z":-120.998105},{"Qw":0.960655,"Qx":0.048218,"Qy":0.271325,"Qz":0.034628,"Time":0.8,"X":-1.206797,"Y":71.180131,"Z":-118.44427},{"Qw":0.961521,"Qx":0.04762,"Qy":0.268041,"Qz":0.036938,"Time":0.833333,"X":0.353425,"Y":70.819414,"Z":-115.903333},{"Qw":0.962483,"Qx":0.046978,"Qy":0.264343,"Qz":0.039268,"Time":0.866667,"X":1.879952,"Y":70.462764,"Z":-113.376726},{"Qw":0.963545,"Qx":0.046287,"Qy":0.260204,"Qz":0.041618,"Time":0.9,"X":3.369412,"Y":70.110588,"Z":-110.865882},{"Qw":0.964708,"Qx":0.045539,"Qy":0.255596,"Qz":0.043989,"Time":0.933333,"X":4.818436,"Y":69.763292,"Z":-108.372236},{"Qw":0.965973,"Qx":0.044728,"Qy":0.250486,"Qz":0.046382,"Time":0.966667,"X":6.223655,"Y":69.421283,"Z":-105.897219},{"Qw":0.967342,"Qx":0.043845,"Qy":0.244838,"Qz":0.048797,"Time":1,"X":7.581699,"Y":69.084967,"Z":-103.442266},{"Qw":0.968815,"Qx":0.04288,"Qy":0.238607,"Qz":0.051235,"Time":1.033333,"X":8.889199,"Y":68.754752,"Z":-101.008808},{"Qw":0.970392,"Qx":0.041822,"Qy":0.231746,"Qz":0.053697,"Time":1.066667,"X":10.142784,"Y":68.431043,"Z":-98.59828},{"Qw":0.972072,"Qx":0.04066,"Qy":0.224201,"Qz":0.056181,"Time":1.1,"X":11.339085,"Y":68.114248,"Z":-96.212113},{"Qw":0.973852,"Qx":0.039378,"Qy":0.215909,"Qz":0.05869,"Time":1.133333,"X":12.474733,"Y":67.804774,"Z":-93.851742},{"Qw":0.975727,"Qx":0.037959,"Qy":0.206803,"Qz":0.061221,"Time":1.166667,"X":13.546357,"Y":67.503026,"Z":-91.518599},{"Qw":0.97769,"Qx":0.036386,"Qy":0.196804,"Qz":0.063775,"Time":1.2,"X":14.550588,"Y":67.209412,"Z":-89.214118},{"Qw":0.979728,"Qx":0.034634,"Qy":0.185824,"Qz":0.066349,"Time":1.233333,"X":15.484057,"Y":66.924338,"Z":-86.93973},{"Qw":0.981827,"Qx":0.032679,"Qy":0.173769,"Qz":0.06894,"Time":1.266667,"X":16.343394,"Y":66.648211,"Z":-84.696871},{"Qw":0.983962,"Qx":0.030492,"Qy":0.16053,"Qz":0.071544,"Time":1.3,"X":17.125229,"Y":66.381438,"Z":-82.486972},{"Qw":0.986105,"Qx":0.028039,"Qy":0.14599,"Qz":0.074153,"Time":1.333333,"X":17.826192,"Y":66.124425,"Z":-80.311466},{"Qw":0.988212,"Qx":0.02528,"Qy":0.130021,"Qz":0.076757,"Time":1.366667,"X":18.442915,"Y":65.877579,"Z":-78.171787},{"Qw":0.990232,"Qx":0.022174,"Qy":0.112489,"Qz":0.079342,"Time":1.4,"X":18.972026,"Y":65.641307,"Z":-76.069368},{"Qw":0.992094,"Qx":0.018672,"Qy":0.093253,"Qz":0.081889,"Time":1.433333,"X":19.410157,"Y":65.416015,"Z":-74.005642},{"Qw":0.993709,"Qx":0.014721,"Qy":0.07217,"Qz":0.08437,"Time":1.466667,"X":19.753939,"Y":65.202111,"Z":-71.982041},{"Qw":0.994966,"Qx":0.010267,"Qy":0.049105,"Qz":0.08675,"Time":1.5,"X":20,"Y":65,"Z":-70},{"Qw":0.995641,"Qx":0.011576,"Qy":0.038582,"Qz":0.084127,"Time":1.533333,"X":20.174721,"Y":64.8025,"Z":-68.048314},{"Qw":0.996191,"Qx":0.012892,"Qy":0.028093,"Qz":0.081541,"Time":1.566667,"X":20.307406,"Y":64.602272,"Z":-66.114535},{"Qw":0.996618,"Qx":0.014211,"Qy":0.017658,"Qz":0.078991,"Time":1.6,"X":20.399075,"Y":64.399486,"Z":-64.198229},{"Qw":0.996924,"Qx":0.015531,"Qy":0.007294,"Qz":0.076476,"Time":1.633333,"X":20.450745,"Y":64.194315,"Z":-62.298961},{"Qw":0.997112,"Qx":0.01685,"Qy":-0.002977,"Qz":0.073995,"Time":1.666667,"X":20.463436,"Y":63.986929,"Z":-60.416297},{"Qw":0.997185,"Qx":0.018166,"Qy":-0.013138,"Qz":0.071546,"Time":1.7,"X":20.438167,"Y":63.777501,"Z":-58.549802},{"Qw":0.997149,"Qx":0.019475,"Qy":-0.023169,"Qz":0.069127,"Time":1.733333,"X":20.375956,"Y":63.566201,"Z":-56.699043},{"Qw":0.997007,"Qx":0.020776,"Qy":-0.033052,"Qz":0.066736,"Time":1.766667,"X":20.277821,"Y":63.353201,"Z":-54.863584},{"Qw":0.996765,"Qx":0.022068,"Qy":-0.04277,"Qz":0.064371,"Time":1.8,"X":20.144783,"Y":63.138673,"Z":-53.042991},{"Qw":0.996429,"Qx":0.023348,"Qy":-0.052306,"Qz":0.06203,"Time":1.833333,"X":19.977859,"Y":62.922788,"Z":-51.23683},{"Qw":0.996006,"Qx":0.024615,"Qy":-0.061644,"Qz":0.05971,"Time":1.866667,"X":19.778068,"Y":62.705718,"Z":-49.444667},{"Qw":0.995503,"Qx":0.025868,"Qy":-0.070771,"Qz":0.057409,"Time":1.9,"X":19.54643,"Y":62.487633,"Z":-47.666067},{"Qw":0.994927,"Qx":0.027105,"Qy":-0.079671,"Qz":0.055125,"Time":1.933333,"X":19.283962,"Y":62.268706,"Z":-45.900596},{"Qw":0.994284,"Qx":0.028326,"Qy":-0.088332,"Qz":0.052856,"Time":1.966667,"X":18.991684,"Y":62.049108,"Z":-44.147818},{"Qw":0.993584,"Qx":0.029529,"Qy":-0.096742,"Qz":0.050598,"Time":2,"X":18.670615,"Y":61.82901,"Z":-42.407301},{"Qw":0.992833,"Qx":0.030715,"Qy":-0.104891,"Qz":0.048349,"Time":2.033333,"X":18.321772,"Y":61.608583,"Z":-40.678609},{"Qw":0.992039,"Qx":0.031881,"Qy":-0.112769,"Qz":0.046108,"Time":2.066667,"X":17.946176,"Y":61.388,"Z":-38.961308},{"Qw":0.991209,"Qx":0.033028,"Qy":-0.120368,"Qz":0.043871,"Time":2.1,"X":17.544845,"Y":61.167432,"Z":-37.254964},{"Qw":0.990352,"Qx":0.034155,"Qy":-0.127679,"Qz":0.041637,"Time":2.133333,"X":17.118797,"Y":60.94705,"Z":-35.559143},{"Qw":0.989475,"Qx":0.035261,"Qy":-0.134697,"Qz":0.039404,"Time":2.166667,"X":16.669051,"Y":60.727025,"Z":-33.873409},{"Qw":0.988584,"Qx":0.036346,"Qy":-0.141416,"Qz":0.037168,"Time":2.2,"X":16.196626,"Y":60.507529,"Z":-32.197328},{"Qw":0.987688,"Qx":0.03741,"Qy":-0.14783,"Qz":0.03493,"Time":2.233333,"X":15.702542,"Y":60.288734,"Z":-30.530467},{"Qw":0.986791,"Qx":0.038451,"Qy":-0.153937,"Qz":0.032685,"Time":2.266667,"X":15.187816,"Y":60.070811,"Z":-28.872391},{"Qw":0.985901,"Qx":0.03947,"Qy":-0.159732,"Qz":0.030433,"Time":2.3,"X":14.653467,"Y":59.853931,"Z":-27.222664},{"Qw":0.985025,"Qx":0.040465,"Qy":-0.165214,"Qz":0.028173,"Time":2.333333,"X":14.100515,"Y":59.638266,"Z":-25.580854},{"Qw":0.984166,"Qx":0.041437,"Qy":-0.170379,"Qz":0.025901,"Time":2.366667,"X":13.529977,"Y":59.423987,"Z":-23.946525},{"Qw":0.983332,"Qx":0.042383,"Qy":-0.175228,"Qz":0.023618,"Time":2.4,"X":12.942874,"Y":59.211266,"Z":-22.319243},{"Qw":0.982526,"Qx":0.043304,"Qy":-0.179758,"Qz":0.02132,"Time":2.433333,"X":12.340222,"Y":59.000274,"Z":-20.698574},{"Qw":0.981754,"Qx":0.044198,"Qy":-0.183969,"Qz":0.019008,"Time":2.466667,"X":11.723043,"Y":58.791183,"Z":-19.084084},{"Qw":0.98102,"Qx":0.045064,"Qy":-0.187861,"Qz":0.01668,"Time":2.5,"X":11.092353,"Y":58.584164,"Z":-17.475337},{"Qw":0.980327,"Qx":0.045901,"Qy":-0.191434,"Qz":0.014334,"Time":2.533333,"X":10.449172,"Y":58.379389,"Z":-15.871899},{"Qw":0.979679,"Qx":0.046708,"Qy":-0.194688,"Qz":0.011969,"Time":2.566667,"X":9.794519,"Y":58.177029,"Z":-14.273337},{"Qw":0.97908,"Qx":0.047484,"Qy":-0.197624,"Qz":0.009584,"Time":2.6,"X":9.129412,"Y":57.977255,"Z":-12.679216},{"Qw":0.978532,"Qx":0.048227,"Qy":-0.200242,"Qz":0.007179,"Time":2.633333,"X":8.45487,"Y":57.780239,"Z":-11.0891},{"Qw":0.978038,"Qx":0.048935,"Qy":-0.202543,"Qz":0.004752,"Time":2.666667,"X":7.771912,"Y":57.586152,"Z":-9.502557},{"Qw":0.9776,"Qx":0.049606,"Qy":-0.204528,"Qz":0.002303,"Time":2.7,"X":7.081557,"Y":57.395167,"Z":-7.919151},{"Qw":0.97722,"Qx":0.050239,"Qy":-0.206197,"Qz":-0.000171,"Time":2.733333,"X":6.384824,"Y":57.207453,"Z":-6.338449},{"Qw":0.976899,"Qx":0.050832,"Qy":-0.207551,"Qz":-0.002668,"Time":2.766667,"X":5.682731,"Y":57.023184,"Z":-4.760015},{"Qw":0.976638,"Qx":0.051383,"Qy":-0.208592,"Qz":-0.00519,"Time":2.8,"X":4.976297,"Y":56.84253,"Z":-3